Biobank,Cluster,Top Terms
Estonian Biobank,0,"aged, 80 and over, alphapapillomavirus, atherosclerosis, attention deficit disorder with hyperactivity, avoidant restrictive food intake disorder, biomarkers, biomarkers, tumor, breast, breast neoplasms, carcinogens"
Estonian Biobank,1,"alpha catenin, animals, anti-bacterial agents, anti-inflammatory agents, antidepressive agents, antigens, surface, antihypertensive agents, attitude, body composition, borrelia burgdorferi"
Estonian Biobank,2,"apolipoprotein b-100, bone density, checkpoint kinase 2, cognitive dysfunction, digeorge syndrome, dna, ancient, early diagnosis, endometriosis, europe, forearm"
Estonian Biobank,3,"adolescent, adult, age factors, aged, biological specimen banks, body mass index, cardiovascular diseases, cohort studies, databases, genetic, diabetes mellitus, type 2"
Estonian Biobank,4,"base sequence, basophils, ccaat-enhancer-binding proteins, cell differentiation, cell lineage, chromosome mapping, databases, nucleic acid, enhancer elements, genetic, epigenesis, genetic, gata2 transcription factor"
Estonian Biobank,5,"adiposity, affect, africa, age of onset, algorithms, alleles, alopecia, arthritis, juvenile, asthma, bayes theorem"
