Cluster,Top Terms
0,"genome-wide association study, polymorphism, single nucleotide, genetic predisposition to disease, risk factors, multifactorial inheritance, phenotype, female, mendelian randomization analysis, case-control studies, genetic loci"
1,"animals, mice, cell line, tumor, disease models, animal, xenograft model antitumor assays, cell proliferation, organoids, mice, nude, gene expression regulation, neoplastic, precision medicine"
2,"child, preschool, child, adolescent, infant, young adult, male, female, infant, newborn, adult, aged, 80 and over"
3,"biological specimen banks, biomedical research, translational research, biomedical, precision medicine, informed consent, specimen handling, united kingdom, neoplasms, genomics, ethics, research"
4,"electronic health records, precision medicine, algorithms, databases, factual, natural language processing, medical informatics, machine learning, phenotype, united states, information storage and retrieval"
5,"genomics, precision medicine, neoplasms, united states, clinical trials as topic, biomedical research, developing countries, covid-19, high-throughput nucleotide sequencing, mutation"
6,"middle aged, aged, male, adult, female, aged, 80 and over, risk factors, young adult, united kingdom, cohort studies"
